{
  "artifactType": "review-plan",
  "schemaVersion": "1.0.0",
  "reviewId": "review-20260506T191638Z",
  "status": "completed",
  "createdAt": "2026-05-06T19:16:38+00:00",
  "updatedAt": "2026-05-06T19:16:38+00:00",
  "items": [
    {
      "itemId": "RVI-001",
      "topic": "security:trust-boundary",
      "priority": 100,
      "packId": "security",
      "status": "completed",
      "files": [
        "src/features/auth/AuthProvider.tsx"
      ],
      "skills": [
        "vulnerability-scanner",
        "red-team-tactics"
      ],
      "checklists": [
        "SEC-TRUST",
        "SEC-AUTHZ"
      ],
      "contextFiles": [
        "src/features/auth/AuthProvider.tsx"
      ],
      "expansions": []
    },
    {
      "itemId": "RVI-002",
      "topic": "frontend:runtime",
      "priority": 50,
      "packId": "frontend",
      "status": "completed",
      "files": [
        "src/features/auth/AuthProvider.tsx"
      ],
      "skills": [
        "nextjs-react-expert"
      ],
      "checklists": [
        "FE-STATE",
        "FE-UX"
      ],
      "contextFiles": [
        "src/features/auth/AuthProvider.tsx"
      ],
      "expansions": []
    }
  ]
}
