{
  "artifactType": "review-plan",
  "schemaVersion": "1.0.0",
  "reviewId": "review-20260423T002233Z",
  "status": "completed",
  "createdAt": "2026-04-23T00:22:33+00:00",
  "updatedAt": "2026-04-23T00:22:34+00:00",
  "items": [
    {
      "itemId": "RVI-001",
      "topic": "security:trust-boundary",
      "priority": 100,
      "packId": "security",
      "status": "completed",
      "files": [
        "backend/api/deps/auth.py",
        "src/features/auth/AuthProvider.tsx"
      ],
      "skills": [
        "vulnerability-scanner",
        "red-team-tactics"
      ],
      "checklists": [
        "SEC-TRUST",
        "SEC-AUTHZ"
      ],
      "contextFiles": [
        "backend/api/deps/auth.py",
        "src/features/auth/AuthProvider.tsx"
      ],
      "expansions": []
    },
    {
      "itemId": "RVI-002",
      "topic": "api:contracts",
      "priority": 80,
      "packId": "api",
      "status": "completed",
      "files": [
        "backend/api/deps/auth.py"
      ],
      "skills": [
        "api-patterns"
      ],
      "checklists": [
        "API-CONTRACT",
        "API-ERRORS"
      ],
      "contextFiles": [
        "backend/api/deps/auth.py"
      ],
      "expansions": []
    },
    {
      "itemId": "RVI-003",
      "topic": "frontend:runtime",
      "priority": 50,
      "packId": "frontend",
      "status": "completed",
      "files": [
        "src/features/auth/AuthProvider.tsx"
      ],
      "skills": [
        "react-performance"
      ],
      "checklists": [
        "FE-STATE",
        "FE-UX"
      ],
      "contextFiles": [
        "src/features/auth/AuthProvider.tsx"
      ],
      "expansions": []
    }
  ]
}
